{
 "_generated_from": {
  "upstream": "17.4.26",
  "upstream_commit": "5d2a06d2a4afe589468f96617080e7aabac3e4f2",
  "file": "code_aster/Cata/Commands/recu_table.py",
  "extractor": "codeaster_en.extract.catalog",
  "extractor_version": "1"
 },
 "schema_version": 1,
 "command": "RECU_TABLE",
 "kind": "OPER",
 "fr": "Récupérer dans une table les valeurs d'un paramètre d'une SD Résultat ou d'extraire une table contenue dans une autre SD pour celles qui le permettent",
 "translation_upstream": null,
 "op": 174,
 "reentrant": null,
 "result_types": [
  "table_sdaster"
 ],
 "result_type_depends_on_keywords": false,
 "has_compat_syntax": false,
 "rules": [
  {
   "rule": "UN_PARMI",
   "keywords": [
    "NOM_TABLE",
    "NOM_PARA",
    "TOUT_PARA"
   ]
  }
 ],
 "source": {
  "file": "code_aster/Cata/Commands/recu_table.py",
  "line": 26
 },
 "keywords": [
  {
   "name": "CO",
   "kind": "simple",
   "path": "CO",
   "status": "o",
   "type": [
    "DataStructure"
   ],
   "fr": null,
   "source": {
    "file": "code_aster/Cata/Commands/recu_table.py",
    "line": 34
   }
  },
  {
   "name": "NOM_TABLE",
   "kind": "simple",
   "path": "NOM_TABLE",
   "status": "f",
   "type": [
    "TXM"
   ],
   "fr": null,
   "source": {
    "file": "code_aster/Cata/Commands/recu_table.py",
    "line": 36
   }
  },
  {
   "name": "NOM_PARA",
   "kind": "simple",
   "path": "NOM_PARA",
   "status": "f",
   "type": [
    "TXM"
   ],
   "max": "**",
   "fr": null,
   "source": {
    "file": "code_aster/Cata/Commands/recu_table.py",
    "line": 37
   }
  },
  {
   "name": "TOUT_PARA",
   "kind": "simple",
   "path": "TOUT_PARA",
   "status": "f",
   "type": [
    "TXM"
   ],
   "into": [
    "OUI"
   ],
   "fr": null,
   "source": {
    "file": "code_aster/Cata/Commands/recu_table.py",
    "line": 38
   }
  },
  {
   "name": "TITRE",
   "kind": "simple",
   "path": "TITRE",
   "status": "f",
   "type": [
    "TXM"
   ],
   "fr": null,
   "source": {
    "file": "code_aster/Cata/Commands/recu_table.py",
    "line": 39
   }
  }
 ]
}
