{
 "_generated_from": {
  "upstream": "17.4.26",
  "upstream_commit": "5d2a06d2a4afe589468f96617080e7aabac3e4f2",
  "file": "code_aster/Cata/Commands/formule.py",
  "extractor": "codeaster_en.extract.catalog",
  "extractor_version": "1"
 },
 "schema_version": 1,
 "command": "FORMULE",
 "kind": "FORM",
 "fr": "Définit une formule réelle ou complexe à partir de son expression mathématique",
 "translation_upstream": null,
 "op": null,
 "reentrant": null,
 "result_types": [
  "formule",
  "formule_c"
 ],
 "result_type_depends_on_keywords": true,
 "has_compat_syntax": false,
 "rules": [
  {
   "rule": "UN_PARMI",
   "keywords": [
    "VALE",
    "VALE_C"
   ]
  }
 ],
 "source": {
  "file": "code_aster/Cata/Commands/formule.py",
  "line": 36
 },
 "keywords": [
  {
   "name": "VALE",
   "kind": "simple",
   "path": "VALE",
   "status": "f",
   "type": [
    "TXM"
   ],
   "fr": null,
   "source": {
    "file": "code_aster/Cata/Commands/formule.py",
    "line": 42
   }
  },
  {
   "name": "VALE_C",
   "kind": "simple",
   "path": "VALE_C",
   "status": "f",
   "type": [
    "TXM"
   ],
   "fr": null,
   "source": {
    "file": "code_aster/Cata/Commands/formule.py",
    "line": 43
   }
  },
  {
   "name": "NOM_PARA",
   "kind": "simple",
   "path": "NOM_PARA",
   "status": "o",
   "type": [
    "TXM"
   ],
   "max": "**",
   "validators": [
    {
     "name": "NoRepeat",
     "args": []
    }
   ],
   "fr": null,
   "source": {
    "file": "code_aster/Cata/Commands/formule.py",
    "line": 44
   }
  }
 ]
}
