{
 "_generated_from": {
  "upstream": "17.4.26",
  "upstream_commit": "5d2a06d2a4afe589468f96617080e7aabac3e4f2",
  "file": "code_aster/Cata/Commands/detruire.py",
  "extractor": "codeaster_en.extract.catalog",
  "extractor_version": "1"
 },
 "schema_version": 1,
 "command": "DETRUIRE",
 "kind": "MACRO",
 "fr": "Détruit des concepts utilisateurs du contexte courant",
 "translation_upstream": null,
 "op": null,
 "reentrant": null,
 "result_types": [],
 "result_type_depends_on_keywords": false,
 "has_compat_syntax": true,
 "rules": [],
 "source": {
  "file": "code_aster/Cata/Commands/detruire.py",
  "line": 46
 },
 "keywords": [
  {
   "name": "NOM",
   "kind": "simple",
   "path": "NOM",
   "status": "o",
   "type": [
    "DataStructure"
   ],
   "max": "**",
   "validators": [
    {
     "name": "NoRepeat",
     "args": []
    }
   ],
   "fr": null,
   "source": {
    "file": "code_aster/Cata/Commands/detruire.py",
    "line": 51
   }
  },
  {
   "name": "INFO",
   "kind": "simple",
   "path": "INFO",
   "status": "f",
   "type": [
    "I"
   ],
   "default": 1,
   "into": [
    1,
    2
   ],
   "fr": null,
   "source": {
    "file": "code_aster/Cata/Commands/detruire.py",
    "line": 52
   }
  }
 ]
}
