{
 "_generated_from": {
  "upstream": "17.4.26",
  "upstream_commit": "5d2a06d2a4afe589468f96617080e7aabac3e4f2",
  "file": "code_aster/Cata/Commands/calc_inte_spec.py",
  "extractor": "codeaster_en.extract.catalog",
  "extractor_version": "1"
 },
 "schema_version": 1,
 "command": "CALC_INTE_SPEC",
 "kind": "OPER",
 "fr": "Calcul d'une matrice interspectrale à partir d'une fonction du temps",
 "translation_upstream": null,
 "op": 120,
 "reentrant": "n",
 "result_types": [
  "interspectre"
 ],
 "result_type_depends_on_keywords": false,
 "has_compat_syntax": false,
 "rules": [],
 "source": {
  "file": "code_aster/Cata/Commands/calc_inte_spec.py",
  "line": 26
 },
 "keywords": [
  {
   "name": "INST_INIT",
   "kind": "simple",
   "path": "INST_INIT",
   "status": "f",
   "type": [
    "R"
   ],
   "default": 0.0,
   "fr": null,
   "source": {
    "file": "code_aster/Cata/Commands/calc_inte_spec.py",
    "line": 32
   }
  },
  {
   "name": "INST_FIN",
   "kind": "simple",
   "path": "INST_FIN",
   "status": "o",
   "type": [
    "R"
   ],
   "fr": null,
   "source": {
    "file": "code_aster/Cata/Commands/calc_inte_spec.py",
    "line": 33
   }
  },
  {
   "name": "DUREE_ANALYSE",
   "kind": "simple",
   "path": "DUREE_ANALYSE",
   "status": "f",
   "type": [
    "R"
   ],
   "fr": null,
   "source": {
    "file": "code_aster/Cata/Commands/calc_inte_spec.py",
    "line": 34
   }
  },
  {
   "name": "DUREE_DECALAGE",
   "kind": "simple",
   "path": "DUREE_DECALAGE",
   "status": "f",
   "type": [
    "R"
   ],
   "fr": null,
   "source": {
    "file": "code_aster/Cata/Commands/calc_inte_spec.py",
    "line": 35
   }
  },
  {
   "name": "NB_POIN",
   "kind": "simple",
   "path": "NB_POIN",
   "status": "o",
   "type": [
    "I"
   ],
   "fr": null,
   "source": {
    "file": "code_aster/Cata/Commands/calc_inte_spec.py",
    "line": 36
   }
  },
  {
   "name": "FONCTION",
   "kind": "simple",
   "path": "FONCTION",
   "status": "o",
   "type": [
    "fonction_sdaster",
    "nappe_sdaster",
    "formule"
   ],
   "max": "**",
   "fr": null,
   "source": {
    "file": "code_aster/Cata/Commands/calc_inte_spec.py",
    "line": 37
   }
  },
  {
   "name": "TITRE",
   "kind": "simple",
   "path": "TITRE",
   "status": "f",
   "type": [
    "TXM"
   ],
   "validators": [
    {
     "name": "NoRepeat",
     "args": []
    }
   ],
   "fr": null,
   "source": {
    "file": "code_aster/Cata/Commands/calc_inte_spec.py",
    "line": 38
   }
  },
  {
   "name": "INFO",
   "kind": "simple",
   "path": "INFO",
   "status": "f",
   "type": [
    "I"
   ],
   "default": 1,
   "into": [
    1,
    2
   ],
   "fr": null,
   "source": {
    "file": "code_aster/Cata/Commands/calc_inte_spec.py",
    "line": 39
   }
  }
 ]
}
