{
 "_generated_from": {
  "upstream": "17.4.26",
  "upstream_commit": "5d2a06d2a4afe589468f96617080e7aabac3e4f2",
  "file": "code_aster/Cata/Commands/maj_cata.py",
  "extractor": "codeaster_en.extract.catalog",
  "extractor_version": "1"
 },
 "schema_version": 1,
 "command": "MAJ_CATA",
 "kind": "PROC",
 "fr": "Compilation des catalogues d'éléments et couverture des calculs élémentaires",
 "translation_upstream": null,
 "op": 20,
 "reentrant": null,
 "result_types": [],
 "result_type_depends_on_keywords": false,
 "has_compat_syntax": false,
 "rules": [
  {
   "rule": "UN_PARMI",
   "keywords": [
    "ELEMENT",
    "TYPE_ELEM"
   ]
  }
 ],
 "source": {
  "file": "code_aster/Cata/Commands/maj_cata.py",
  "line": 24
 },
 "keywords": [
  {
   "name": "ELEMENT",
   "kind": "factor",
   "path": "ELEMENT",
   "status": "f",
   "fr": null,
   "source": {
    "file": "code_aster/Cata/Commands/maj_cata.py",
    "line": 29
   },
   "keywords": []
  },
  {
   "name": "UNITE",
   "kind": "simple",
   "path": "UNITE",
   "status": "f",
   "type": [
    "UnitDefault"
   ],
   "default": 8,
   "inout": "out",
   "fr": null,
   "source": {
    "file": "code_aster/Cata/Commands/maj_cata.py",
    "line": 30
   }
  },
  {
   "name": "TYPE_ELEM",
   "kind": "factor",
   "path": "TYPE_ELEM",
   "status": "f",
   "fr": null,
   "source": {
    "file": "code_aster/Cata/Commands/maj_cata.py",
    "line": 31
   },
   "keywords": []
  }
 ]
}
