{
 "_generated_from": {
  "upstream": "17.4.26",
  "upstream_commit": "5d2a06d2a4afe589468f96617080e7aabac3e4f2",
  "file": "code_aster/Cata/Commands/exec_logiciel.py",
  "extractor": "codeaster_en.extract.catalog",
  "extractor_version": "1"
 },
 "schema_version": 1,
 "command": "EXEC_LOGICIEL",
 "kind": "MACRO",
 "fr": "Exécute un logiciel ou une commande système depuis Aster",
 "translation_upstream": null,
 "op": "code_aster.MacroCommands.exec_logiciel_ops.exec_logiciel_ops",
 "reentrant": null,
 "result_types": [],
 "result_type_depends_on_keywords": false,
 "has_compat_syntax": false,
 "rules": [],
 "source": {
  "file": "code_aster/Cata/Commands/exec_logiciel.py",
  "line": 25
 },
 "keywords": [
  {
   "name": "LOGICIEL",
   "kind": "simple",
   "path": "LOGICIEL",
   "status": "o",
   "type": [
    "TXM"
   ],
   "fr": "Programme ou script à exécuter",
   "source": {
    "file": "code_aster/Cata/Commands/exec_logiciel.py",
    "line": 30
   }
  },
  {
   "name": "ARGUMENT",
   "kind": "simple",
   "path": "ARGUMENT",
   "status": "f",
   "type": [
    "TXM"
   ],
   "max": "**",
   "fr": "Arguments à transmettre à LOGICIEL",
   "source": {
    "file": "code_aster/Cata/Commands/exec_logiciel.py",
    "line": 31
   }
  },
  {
   "name": "SHELL",
   "kind": "simple",
   "path": "SHELL",
   "status": "f",
   "type": [
    "TXM"
   ],
   "default": "NON",
   "into": [
    "OUI",
    "NON"
   ],
   "fr": "Execution dans un shell, nécessaire si LOGICIEL n'est pas un exécutable mais une ligne de commande complète utilisant des redirections ou des caractères de completions",
   "source": {
    "file": "code_aster/Cata/Commands/exec_logiciel.py",
    "line": 32
   }
  },
  {
   "name": "CODE_RETOUR_MAXI",
   "kind": "simple",
   "path": "CODE_RETOUR_MAXI",
   "status": "f",
   "type": [
    "I"
   ],
   "val_min": -1,
   "default": 0,
   "fr": "Valeur maximale du code retour toléré (-1 pour l'ignorer)",
   "source": {
    "file": "code_aster/Cata/Commands/exec_logiciel.py",
    "line": 43
   }
  },
  {
   "name": "INFO",
   "kind": "simple",
   "path": "INFO",
   "status": "f",
   "type": [
    "I"
   ],
   "default": 2,
   "into": [
    1,
    2
   ],
   "fr": null,
   "source": {
    "file": "code_aster/Cata/Commands/exec_logiciel.py",
    "line": 50
   }
  }
 ]
}
